{
  "record_type": "AOSS_V0_6_STAGE_A_COLLECTION_AUTHORIZATION",
  "schema_version": 1,
  "controller_issue": 890,
  "status": "AUTHORIZED_BOUNDED_STAGE_A_COLLECTION",
  "authority": {
    "class": "PROJECT_OWNER_EXPLICIT_AUTHORIZATION",
    "actor": "ndrorchestration",
    "decision": "AUTHORIZE_EXACT_FROZEN_STAGE_A_COLLECTION_ONLY"
  },
  "authorization_basis": {
    "issue": 890,
    "comment_id": 5744865345,
    "comment_url": "https://github.com/ndrorchestration/DGAF-Framework/issues/890#issuecomment-5744865345"
  },
  "protected_source_basis": "807216df1bd5b28c677b8c42822975b2941c1211",
  "source_system": {
    "repository": "ndrorchestration/agent-control-plane",
    "commit": "dbab7c1afafec524ce7c18157de2089cafe79c87",
    "provenance_schema": "agent-control-plane.provenance.v1"
  },
  "apparatus": {
    "accepted_commit": "69821cdcc1b9b9432b7001c6f52c867f9669f54d",
    "adapter_version": "AOSS_V0_6_ACP_ADAPTER_V1",
    "decision_policy": "AOSS_V0_6_STAGE_A_POLICY_V1",
    "primary_comparator": "AOSS_V0_6_ACP_DIRECT_EVENT_BASELINE_V1"
  },
  "scope": {
    "episode_classes": 16,
    "canonical_source_episodes_per_class": 1,
    "exact_byte_replay_passes_per_episode": 5,
    "frozen_eligibility_only": true,
    "frozen_failure_ground_truth_only": true,
    "frozen_analysis_only": true
  },
  "non_effects": [
    "DOES_NOT_ESTABLISH_EXTERNAL_VALIDATION",
    "DOES_NOT_ESTABLISH_AOSS_SUPERIORITY",
    "DOES_NOT_ESTABLISH_DGAF_EFFICACY",
    "DOES_NOT_ESTABLISH_INDEPENDENT_VALIDATION",
    "DOES_NOT_AUTHORIZE_PRODUCTION_ASSURANCE",
    "DOES_NOT_AUTHORIZE_HIGH_ASSURANCE",
    "DOES_NOT_REOPEN_OR_POOL_TRACK_A_EPOCH_002",
    "DOES_NOT_INCREMENT_SCIENTIFIC_N_BEFORE_GOVERNED_ANALYSIS_AND_DISPOSITION"
  ],
  "outcome_collection_authorized": true,
  "external_validation_established": false,
  "scientific_n_increment": 0,
  "canonical_dgaf_efficacy": "NOT_ESTABLISHED",
  "high_assurance": "NOT_AUTHORIZED"
}
